{
 "schemaVersion": "1.0.0",
 "approvalId": "APR-TASK-M0A-007-R1",
 "subjectType": "taskPacket",
 "subjectId": "TASK-M0A-007",
 "subjectRevision": 1,
 "subjectSha256": "6f87bbde251d4eddb3e01543426b3fbe8ff33f33f8745de892afb87cb7ef1ed4",
 "baseRevision": "e56fea2983192a96e394783021bf2026b75527db",
 "decision": "approved",
 "approver": {
  "kind": "human",
  "id": "lvye"
 },
 "approvedAt": "2026-07-13T06:49:46Z",
 "mechanism": "detachedSignature",
 "approvalRef": "arkdeck-trust:ORG-ARKDECK-ROOT-1:APR-TASK-M0A-007-R1",
 "signature": "-----BEGIN SSH SIGNATURE-----\nU1NIU0lHAAAAAQAAADMAAAALc3NoLWVkMjU1MTkAAAAgWPCFmreJKa9U6soBBqsG4sOGV2\na++nxEurCvWqlZr7oAAAAQYXJrZGVjay1hcHByb3ZhbAAAAAAAAAAGc2hhNTEyAAAAUwAA\nAAtzc2gtZWQyNTUxOQAAAEBFtyB2dXKOTXq72/S2wHB52UV0whZQLNRwSdo9IHesxExuyK\nXoLwDk59S3flMOAzcceHKKk1RtRp6/z+svRyQA\n-----END SSH SIGNATURE-----\n"
}
